,title,url
0,Lula e Bolsonaro tentam interditar o debate sobre a terceira via,https://blogs.oglobo.globo.com/vera-magalhaes/post/debate-interditado.html
1,"Mal do sistema é a reeleição, não o presidencialismo",https://oglobo.globo.com/opiniao/semipresidencialismo-um-velho-golpe-25119105
2,Bolsonaro faz da TV Brasil um canal estatal de dar inveja à Coreia do Norte,https://blogs.oglobo.globo.com/bernardo-mello-franco/post/bom-dia-coreia-do-norte-tv-brasil-nas-maos-do-bolsonarismo.html
3,A louca do esquilo: os primeiros tempos morando em Nova York,https://oglobo.globo.com/cultura/a-louca-do-esquilo-1-25118737
4, Bela Megale: Bolsonaro usa recondução de Aras à PGR para pressionar Senado a aprovar Mendonça para o STF ,https://blogs.oglobo.globo.com/bela-megale/post/bolsonaro-usa-reconducao-de-aras-na-pgr-para-botar-pressao-sobre-escolha-no-supremo.html
5,Lauro Jardim: As chances de Aras ter seu nome aprovado no Senado,https://blogs.oglobo.globo.com/lauro-jardim/post/chances-de-aras-no-senado.html
6,Veja sete momentos em que Aras se alinhou aos interesses de Bolsonaro,https://oglobo.globo.com/brasil/veja-sete-momentos-em-que-aras-se-alinhou-aos-interesses-de-bolsonaro-25119250
7,Malu Gaspar: Alcolumbre tenta articulação para emplacar Pacheco contra Mendonça no Supremo,https://blogs.oglobo.globo.com/malu-gaspar/post/o-plano-de-davi-alcolumbre-para-tantar-barrar-andre-mendonca-no-supremo.html
8,Médicos e advogados fazem pressão no Congresso contra reforma do Imposto de Renda,https://oglobo.globo.com/economia/medicos-advogados-fazem-pressao-no-congresso-contra-reforma-do-imposto-de-renda-25119070
9," Brasil goleia a China na estreia em Tóquio, e Marta vira a 1ª mulher a marcar em cinco edições de Jogos Olímpicos ",https://oglobo.globo.com/esportes/toquio-2020/olimpiadas-selecao-feminina-estreia-em-toquio-com-goleada-sobre-china-25119515
10,Entenda como a corrida espacial dos bilionários gera negócios e pode abrir novas fronteiras,https://oglobo.globo.com/economia/tecnologia/entenda-como-corrida-espacial-dos-bilionarios-ja-gera-negocios-na-terra-pode-abrir-novas-fronteiras-25118761
11,Quer viajar ao espaço? Veja o que você precisa além de (muito) dinheiro,https://oglobo.globo.com/economia/tecnologia/quer-viajar-ao-espaco-veja-que-voce-precisa-alem-de-muito-dinheiro-25118840
12,"Com demora na entrega de vacinas, cidades do Rio suspendem calendário de imunização",https://oglobo.globo.com/rio/com-demora-na-entrega-de-vacinas-cidades-do-rio-suspendem-calendario-de-imunizacao-contra-covid-19-ate-nova-remessa-25119139
13,"Confira o calendário de vacinação nesta quarta em São Paulo, Rio, Niterói e mais 6 cidades",https://oglobo.globo.com/sociedade/saude/confira-calendario-de-vacinacao-nesta-quarta-feira-em-sao-paulo-rio-niteroi-mais-seis-cidades-3-24910341
14,"
Após um ano e meio de pandemia, imunidade contra a Covid-19 ainda gera dúvidas
",https://oglobo.globo.com/sociedade/saude/apos-um-ano-meio-de-pandemia-imunidade-contra-covid-19-ainda-gera-duvidas-25117032
15,"
Capital: Site de venda de imóveis EmCasa obtém aporte de R$ 110 milhões
",https://blogs.oglobo.globo.com/capital/post/site-de-venda-de-imoveis-emcasa-obtem-aporte-de-r-110-milhoes.html
16,"Fenômeno nas redes sociais, Douglas do Vôlei comemora sucesso:' Viralizei do nada. Estou em choque'",https://oglobo.globo.com/esportes/fenomeno-nas-redes-sociais-douglas-do-volei-comemora-sucesso-viralizei-do-nada-estou-em-choque-25119490
17,"
Saiba o que pensa Maurício Borges, parceiro de quarto de Douglas Souza, sobre os vídeos da concentração
",https://oglobo.globo.com/esportes/saiba-que-pensa-mauricio-borges-parceiro-de-quarto-de-douglas-souza-sobre-os-videos-da-concentracao-25119497
18,Brisbane é oficializada como sede dos Jogos Olímpicos de 2032,https://oglobo.globo.com/esportes/brisbane-oficializada-como-sede-dos-jogos-olimpicos-de-2032-25119501
19,"Bruno Soares, do tênis, passará por cirurgia e está fora dos Jogos de Tóquio ",https://oglobo.globo.com/esportes/olimpiadas-2021-bruno-soares-do-tenis-passara-por-cirurgia-esta-fora-dos-jogos-de-toquio-25119493
20,A Olimpíada da teimosia: organização dos Jogos tem pouco a ver com sensatez,https://oglobo.globo.com/esportes/martin-fernandez-olimpiada-da-teimosia-25119307
21,Ataques cibernéticos a empresas no Brasil crescem 220% em 2021,https://blogs.oglobo.globo.com/ancelmo/post/cresceram-220-os-ataques-ciberneticos-empresas-no-brasil-em-2021.html
22,Confiança na economia leva premier a falar em libertação total no verão,https://blogs.oglobo.globo.com/portugal-giro/post/confianca-na-economia-leva-premier-de-portugal-falar-em-libertacao-total-no-verao.html
23,Reforma tributária demanda mais técnica,https://oglobo.globo.com/economia/reforma-tributaria-demanda-mais-tecnica-25118652
24,Outros destaques,https://oglobo.globo.com/ultimas-noticias
25," Premiada em Cannes, brasileira quer fazer filme sobre 'igreja evangélica e o país de tensões quase palpáveis' ",https://oglobo.globo.com/cultura/filmes/premiada-em-cannes-brasileira-quer-fazer-filme-sobre-igreja-evangelica-o-pais-de-tensoes-quase-palpaveis-25118896
26,"Trabalhador brasileiro completa um ano sem aumento acima da inflação, diz Fipe",https://oglobo.globo.com/economia/trabalhador-brasileiro-completa-um-ano-sem-aumento-acima-da-inflacao-diz-fipe-25118927
27,Nego do Borel é indiciado por violência doméstica contra ex-namorada ,https://oglobo.globo.com/rio/nego-do-borel-indiciado-por-violencia-domestica-contra-ex-namorada-25119456
28,"
Jeff Bezos, a fila do foguete e o futuro do turismo espacial: confira tudo no Ao Ponto de hoje
",https://oglobo.globo.com/podcast/jeff-bezos-fila-do-foguete-o-futuro-do-turismo-espacial-25118841
29,"
Quem é o chef que alimenta vítimas de desastres e ganhou US$ 100 milhões de Bezos após o bilionário voltar do espaço
",https://oglobo.globo.com/economia/quem-o-chef-que-alimenta-vitimas-de-desastres-ganhou-us-100-milhoes-de-bezos-apos-bilionario-voltar-do-espaco-25118983
30,"
Detran-RJ inicia campanha bem-humorada para reduzir faltas aos atendimentos agendados
",https://oglobo.globo.com/rio/detran-inicia-campanha-bem-humorada-para-reduzir-faltas-aos-atendimentosagendados-1-25119107
31,"
'Vamos até o fim. Queremos toda justiça do mundo', diz artista circense dona de cadela morta por policial no Rio
",https://oglobo.globo.com/rio/vamos-ate-fim-queremos-toda-justica-do-mundo-diz-artista-circense-que-perdeu-cadela-morta-por-policial-civil-25118338
32, Pressão da Casa Branca expõe flanco do Facebook aberto à desinformação ,https://oglobo.globo.com/mundo/pressao-da-casa-branca-expoe-flanco-do-facebook-aberto-desinformacao-25119149
33,"Castillo faz discurso conciliador no Peru, mas governará sob pressão da esquerda e da direita",https://oglobo.globo.com/mundo/castillo-faz-discurso-conciliador-no-peru-mas-governara-sob-pressao-da-esquerda-da-direita-1-25118482
34,DNA comprova que borboleta extinta pela ação humana era uma espécie própria,https://oglobo.globo.com/sociedade/epoca/exame-de-dna-comprova-que-borboleta-extinta-pela-acao-humana-era-uma-especie-propria-25119243
35, Sonar: Queiroga suspende nomeação de médica defensora da cloroquina para direção de hospital no Rio ,https://blogs.oglobo.globo.com/sonar-a-escuta-das-redes/post/queiroga-suspende-nomeacao-de-medica-defensora-da-cloroquina-para-hospital-federal-no-rio.html
36," Série da categoria 'é ruim, mas é boa', 'Virgin river' fica entre as mais vistas da Netflix ",https://kogut.oglobo.globo.com/noticias-da-tv/critica/noticia/2021/07/serie-da-categoria-e-ruim-mas-e-boa-virgin-river-fica-entre-mais-vistas-da-netflix.html
37, SONAR: Queiroga suspende nomeação de médica defensora da cloroquina para hospital federal no Rio ,https://blogs.oglobo.globo.com/sonar-a-escuta-das-redes/post/queiroga-suspende-nomeacao-de-medica-defensora-da-cloroquina-para-hospital-federal-no-rio.html
38, Start-up de boxes para armazenamento M3storage chega ao Rio e planeja expansão pelo interior do Brasil ,https://blogs.oglobo.globo.com/pense-grande/post/start-de-boxes-para-armazenamento-m3storage-chega-ao-rio-e-planeja-expansao-pelo-interior-do-brasil.html
39, Lana Rhodes fala da volta à TV e inconvenientes por confusão com atriz pornô homônima ,https://kogut.oglobo.globo.com/noticias-da-tv/noticia/2021/07/lana-rhodes-fala-da-volta-tv-em-novela-das-18h-da-vida-de-mae-solo-e-de-inconvenientes-por-confusao-com-atriz-porno-homonima.html
40,Dançarino brasileiro é morto a facadas em rua de Amsterdã; polícia investiga briga de trânsito,https://oglobo.globo.com/brasil/dancarino-brasileiro-morto-facadas-em-rua-de-amsterda-policia-investiga-briga-de-transito-1-25119123
41,Jogos O GLOBO: divirta-se jogando Sudoku e palavras cruzadas,https://oglobo.globo.com/jogos/
