,title,url
0,Lauro Jardim: Ofício da Precisa a Elcio Franco contradiz versão sobre pagamento por vacinas,https://blogs.oglobo.globo.com/lauro-jardim/post/oficio-da-precisa-elcio-franco-contradiz-versao-sobre-pagamento-por-vacinas.html
1,Classe C vai perder R$ 10 bi por ano com Reforma Tributária,https://blogs.oglobo.globo.com/miriam-leitao/post/reforma-vai-tirar-r-10-bi-da-classe-c.html
2,Como os militares veem a discussão do voto impresso,https://blogs.oglobo.globo.com/malu-gaspar/post/militares-embarcam-na-tese-de-fraude-nas-eleicoes.html
3,Cuba fica atrás do Irã em democracia,https://blogs.oglobo.globo.com/guga-chacra/post/cuba-fica-atras-do-ira-em-democracia.html
4," Bolsonaro evolui 'de forma satisfatória', mas sem previsão de alta; Planalto ainda não avalia possibilidade de licença ",https://oglobo.globo.com/brasil/medicos-afirmam-que-bolsonaro-evolui-de-forma-satisfatoria-mas-segue-sem-previsao-de-alta-25111070
5,CPI ao vivo: representante da Davati diz que foi procurado pelo Ministério e avisado por PM sobre 'comissionamento',https://oglobo.globo.com/brasil/a-cpi-representante-da-davati-diz-que-foi-procurado-por-ministerio-da-saude-avisado-por-pm-sobre-comissionamento-25110674
6,Flávio Bolsonaro leva Renan a Conselho de Ética: 'interesses egoísticos na CPI ,https://blogs.oglobo.globo.com/lauro-jardim/post/flavio-bolsonaro-leva-renan-conselho-de-etica-interesses-egoisticos-na-cpi.html
7,"Lauro Jardim: vacinado com duas doses, Doria é infectado novamente pela Covid ",https://blogs.oglobo.globo.com/lauro-jardim/post/doria-testa-positivo-pela-segunda-vez.html
8,"Bolsonaro cancela 'live' e viagem, mas pode despachar do hospital",https://oglobo.globo.com/brasil/bolsonaro-cancela-live-viagem-mas-pode-despachar-do-hospital-1-25111494
9, Alto comando militar americano se preparou para tentativa de golpe de Trump ,https://oglobo.globo.com/mundo/alto-comando-militar-americano-se-preparou-para-frear-tentativa-de-golpe-de-trump-25110952
10,"Trump chamou Merkel de 'aquela vadia' durante reunião na Casa Branca, diz livro",https://oglobo.globo.com/mundo/trump-chamou-merkel-de-aquela-vadia-durante-reuniao-na-casa-branca-diz-livro-1-25111189
11,Olavo de Carvalho é operado para extração de lesões na bexiga em SP,https://oglobo.globo.com/brasil/olavo-de-carvalho-operado-para-extracao-de-lesoes-na-bexigaem-sp-25111020
12,"
WhatsApp Web vai funcionar mesmo com smartphone desligado ou sem acesso a internet. Entenda
",https://oglobo.globo.com/economia/tecnologia/whatsapp-web-vai-funcionar-mesmo-com-smartphone-desligado-ou-sem-acesso-internet-entenda-25110888
13,"Câmara aprova fundo eleitoral em 2022 de R$ 5,7 bilhões, o triplo das eleições em 2018",https://oglobo.globo.com/brasil/camara-aprova-fundo-eleitoral-em-2022-de-57-bilhoes-triplo-das-eleicoes-em-2018-1-25111132
14,"Paes anuncia plano de metas até 2024, revela déficit de R$ 6 bi da gestão anterior, mas garante contas no azul",https://oglobo.globo.com/rio/paes-anuncia-plano-de-metas-ate-2024-revela-deficit-de-6-bilhoes-deixado-pela-gestao-anterior-mas-garante-contas-no-azul-25111378
15,"
Região da Calábria, na Itália, vai oferecer 28 mil euros a quem se mudar para seus vilarejos
",https://oglobo.globo.com/economia/regiao-da-calabria-na-italia-vai-oferecer-28-mil-euros-quem-se-mudar-para-seus-vilarejos-25110701
16,Mario Frias é acusado de racismo após dizer que o youtuber Jones Manoel 'precisa de um bom banho',https://oglobo.globo.com/cultura/mario-frias-acusado-de-racismo-apos-dizer-que-youtuber-jones-manoel-precisa-de-um-bom-banho-25111291
17,Preso um dos suspeitos de envolvimento na morte de estudante sequestrado na Zona Sul do Rio,https://oglobo.globo.com/rio/integrante-de-quadrilha-de-traficantes-de-classe-media-preso-enquanto-assistia-jogo-de-futevolei-em-copacabana-25111160
18,"Com PCR falso, torcedores argentinos viram final da Copa América no Maracanã",https://oglobo.globo.com/esportes/epoca/com-pcr-falso-torcedores-argentinos-viram-final-da-copa-america-no-maracana-25109681
19,"Olimpíada: Negacionismo da vacina emerge entre atletas, apesar da falta de respaldo médico",https://oglobo.globo.com/esportes/toquio-2020/olimpiada-negacionismo-da-vacina-emerge-entre-atletas-apesar-da-falta-de-respaldo-medico-1-25110495
20,"
Fla deve ser responsável por testes de Covid e corrigir erros da Conmebol para poder ter torcida no Maracanã, diz secretário
",https://oglobo.globo.com/esportes/flamengo-deve-ser-responsavel-por-testes-de-covid-corrigir-erros-da-conmebol-para-poder-ter-torcida-no-maracana-diz-secretario-25111145
21,"Insatisfação popular saiu, enfim, do armário em Cuba",https://oglobo.globo.com/cultura/cuba-libre-insatisfacao-popular-saiu-enfim-do-armario-25110045
22,"Rombo de R$ 30 bi no IR pode fazer o BC subir mais os juros, diz XP",https://blogs.oglobo.globo.com/miriam-leitao/post/rombo-de-r-30-bilhoes-no-ir-pode-fazer-o-bc-subir-mais-os-juros-diz-xp.html
23,Ministros militares desvirtuam o sentido do Ministério da Defesa,https://blogs.oglobo.globo.com/merval-pereira/post/o-poder-civil.html
24,Por que a Renner está comprando o brechó on-line Repassa e entrando no mercado de usados,https://blogs.oglobo.globo.com/capital/post/por-que-renner-esta-comprando-o-brecho-line-repassa-e-entrando-no-mercado-de-usados.html
25,Outros destaques,https://oglobo.globo.com/ultimas-noticias
26, Vídeo: passageira é imobilizada com fita adesiva em poltrona de avião após morder comissário ,https://oglobo.globo.com/mundo/video-passageira-imobilizada-com-fita-adesiva-em-poltrona-de-aviao-apos-morder-comissario-25110948
27,Analítico: Aumento de assassinatos em 2020 traz problemas para Lula e Bolsonaro em 2022,https://oglobo.globo.com/analitico/aumento-de-assassinatos-em-2020-traz-problemas-para-lula-bolsonaro-em-2022-25111096
28,"Quatro milhões de estudantes se inscrevem para o Enem, menor número em 14 anos",https://oglobo.globo.com/sociedade/educacao/quatro-milhoes-de-estudantes-se-inscrevem-para-enem-2021-menor-numero-em-14-anos-25111460
29,"
Duas farmácias são fechadas no Méier e no Recreio por venda ilegal de medicamentos e tráfico de drogas
",https://oglobo.globo.com/rio/duas-farmacias-sao-fechadas-no-meier-no-recreio-por-venda-ilegal-de-medicamentos-trafico-de-drogas-25111505
30,"
Vídeos: Fortes chuvas deixam mais de 60 mortos na Europa; Alemanha e Bélgica são mais afetadas
",https://oglobo.globo.com/mundo/videos-fortes-chuvas-deixam-mais-de-60-mortos-na-europa-alemanha-belgica-sao-mais-afetadas-25110702
31,"
Elite da polícia recebe até 16 vezes mais do que a base da categoria, diz Anuário de Segurança
",https://oglobo.globo.com/brasil/elite-da-policia-recebe-ate-16-vezes-mais-do-que-base-da-categoria-diz-anuario-de-seguranca-1-25110465
32,"Covid-19: variante Delta já circula pela cidade do Rio, diz secretário após confirmação de transmissão local",https://oglobo.globo.com/rio/covid-19-variante-delta-ja-circula-pela-cidade-do-rio-diz-secretario-apos-confirmacao-de-transmissao-local-1-25110654
33,Magazine Luiza compra site KaBum! por R$ 1 bi e avança no mercado de games; ações disparam,https://oglobo.globo.com/economia/magazine-luiza-compra-site-kabum-por-1-bi-avanca-no-mercado-de-games-1-25110986
34, ACERVO: A primeira visita de Fidel Castro aos EUA e as origens do embargo econômico contra Cuba ,https://blogs.oglobo.globo.com/blog-do-acervo/post/cuba-visita-amigavel-de-fidel-castro-aos-eua-e-origens-do-embargo-economico.html
35,"Protestos em Cuba: Ricky Martin, Julieta Venegas e Gloria Estefan se manifestam em apoio ao país caribenho ",https://oglobo.globo.com/mundo/protestos-em-cuba-ricky-martin-julieta-venegas-gloria-estefan-se-manifestam-em-apoio-ao-pais-caribenho-25111236
36,Primeiro-ministro do Haiti é investigado como possível mandante de assassinato do presidente,https://oglobo.globo.com/mundo/primeiro-ministro-do-haiti-investigado-como-possivel-mandante-de-assassinato-do-presidente-25110932
37, Representante da Davati diz que foi avisado por PM sobre 'comissionamento' ,https://oglobo.globo.com/brasil/representante-da-davati-diz-que-foi-avisado-por-pm-sobre-comissionamento-25111564
38," Após diversos problemas no programa SuperaRJ, Castro promete solução em 30 dias ",https://oglobo.globo.com/rio/apos-diversos-problemas-no-programa-superarj-castro-promete-solucao-em-30-dias-25111552
39, Flávio Bolsonaro alega ser alvo de “investigação paralela” e pede que Conselho de Ética abra processo contra Renan ,https://oglobo.globo.com/brasil/flavio-bolsonaro-alega-ser-alvo-de-investigacao-paralela-pede-que-conselho-de-etica-abra-processo-contra-renan-25111550
40, Lauro Jardim: Flávio Bolsonaro leva Renan a Conselho de Ética: 'interesses egoísticos na CPI ,https://blogs.oglobo.globo.com/lauro-jardim/post/flavio-bolsonaro-leva-renan-conselho-de-etica-interesses-egoisticos-na-cpi.html
41," Violência e pilhagem diminuem na África do Sul, mas número de mortos sobe para 117 ",https://oglobo.globo.com/mundo/violencia-pilhagem-diminuem-na-africa-do-sul-mas-numero-de-mortos-sobe-para-117-1-25111536
42,"
Cabelo rosa e sangue fake no nariz: Cruz Beckham causa nas redes sociais; veja o vídeo
",https://oglobo.globo.com/ela/gente/cabelo-rosa-sangue-fake-no-nariz-cruz-beckham-causa-nas-redes-sociais-veja-video-25111462
