,title,url
0,"Pausa na CPI é estratégica e bem-vinda, estamos todos exaustos",https://blogs.oglobo.globo.com/vera-magalhaes/post/pausa-na-cpi-e-bem-vinda.html
1,"Presidente da República é servidor público, sim: está no Código Penal",https://blogs.oglobo.globo.com/bernardo-mello-franco/post/o-presidente-que-nao-serve.html
2,"Vacinado com duas doses, Doria é infectado novamente pela Covid ",https://blogs.oglobo.globo.com/lauro-jardim/post/doria-testa-positivo-pela-segunda-vez.html
3,PDT recorre ao STF para obrigar Lira a analisar pedidos de impeachment contra Bolsonaro,https://blogs.oglobo.globo.com/ancelmo/post/pdt-recorre-ao-stf-para-obrigar-lira-analisar-pedidos-de-impeachment-contra-bolsonaro.html
4, Lauro Jardim: Flávio Bolsonaro leva Renan a Conselho de Ética: 'interesses egoísticos' ,https://blogs.oglobo.globo.com/lauro-jardim/post/flavio-bolsonaro-leva-renan-conselho-de-etica-interesses-egoisticos-na-cpi.html
5,Representante da Davati diz que grupo de coronel que trabalhou na Saúde pediu 'comissionamento' ,https://oglobo.globo.com/brasil/representante-da-davati-diz-que-grupo-de-coronel-que-trabalhou-na-saude-pediu-comissionamento-25111474
6,Lauro Jardim: Bolsonaro telefona para Arthur Lira e acena com licença da Presidência,https://blogs.oglobo.globo.com/lauro-jardim/post/bolsonaro-telefona-para-arthur-lira-e-acena-com-licenca-da-presidencia.html
7,"Internado, Bolsonaro concede entrevista e diz que chance de cirurgia está ‘afastada’",https://oglobo.globo.com/brasil/internado-bolsonaro-concede-entrevista-diz-que-chance-de-cirurgia-esta-afastada-1-25111837
8,"Médicos retiram sonda, e Bolsonaro segue internado em SP sem previsão de alta",https://oglobo.globo.com/brasil/medicos-retiram-sonda-bolsonaro-segue-internado-em-sp-sem-previsao-de-alta-25111954
9," 'Se eu fosse dar um golpe, não seria com Milley', diz Trump sobre temor de general ",https://oglobo.globo.com/mundo/se-eu-fosse-dar-um-golpe-nao-seria-com-milley-diz-trump-sobre-temor-de-general-1-25111969
10,Bolsonaro autoriza produção de vacinas contra Covid pela indústria veterinária,https://oglobo.globo.com/sociedade/saude/bolsonaro-autoriza-producao-de-vacinas-contra-covid-pela-industria-veterinaria-25112354
11,Rio prevê vacinar todos contra Covid com duas doses em novembro e estuda reforço para idosos em outubro,https://oglobo.globo.com/rio/rio-antecipa-para-agosto-inicio-da-vacinacao-contra-covid-19-de-adolescentes-estuda-terceira-dose-em-idosos-em-outubro-confira-as-datas-25111942
12,"
Bela Megale: O recado de Omar para Carlos Bolsonaro: 'Se tivesse boa criação, talvez hoje tivesse a coragem esperada de um homem'
",https://blogs.oglobo.globo.com/bela-megale/post/o-recado-de-omar-aziz-para-carlos-bolsonaro-se-tivesse-tido-boa-criacao-talvez-hoje-tivesse-coragem-esperada-de-um-homem.html
13,Google tira do ar canal Terça Livre no Youtube após decisão judicial,https://oglobo.globo.com/brasil/google-tira-do-ar-canal-terca-livre-do-youtube-apos-decisao-judicial-25112114
14,"Congresso aprova fundo eleitoral em 2022 de R$ 5,7 bi, o triplo do valor disponível em 2018",https://oglobo.globo.com/brasil/congresso-aprova-fundo-eleitoral-em-2022-de-57-bilhoes-triplo-das-eleicoes-em-2018-25111132
15,"Época: Principal cartão-postal da França, Torre Eiffel reabre ao público nesta sexta-feira",https://oglobo.globo.com/mundo/epoca/principal-cartao-postal-da-franca-torre-eiffel-reabre-ao-publico-nesta-sexta-feira-25111167
16,WhatsApp Web vai funcionar mesmo com smartphone desligado ou sem acesso a internet. Entenda,https://oglobo.globo.com/economia/tecnologia/whatsapp-web-vai-funcionar-mesmo-com-smartphone-desligado-ou-sem-acesso-internet-entenda-25110888
17,"
Namorado sequer desceu do apartamento após queda de modelo brasileira, diz amiga
",https://oglobo.globo.com/brasil/namorado-sequer-desceu-do-apartamento-apos-queda-de-modelo-brasileira-diz-amiga-isso-chocante-1-25111923
18,"Região da Calábria, na Itália, vai oferecer 28 mil euros a quem se mudar para seus vilarejos",https://oglobo.globo.com/economia/regiao-da-calabria-na-italia-vai-oferecer-28-mil-euros-quem-se-mudar-para-seus-vilarejos-25110701
19,Tire suas dúvidas sobre a bolsa de R$ 550 que governo quer criar para treinar jovens,https://oglobo.globo.com/economia/tire-suas-duvidas-sobre-bolsa-de-550-que-governo-quer-criar-para-treinar-jovens-25112212
20,"Inscrição em árabe na Escadaria Selarón, no Rio, vira assunto nas redes",https://oglobo.globo.com/cultura/inscricao-em-arabe-na-escadaria-selaron-vira-assunto-nas-redes-25111354
21,"Conheça João Victor Marcari Oliva, filho de Hortência, o primeiro brasileiro a entrar na Vila Olímpica em Tóquio",https://oglobo.globo.com/esportes/toquio-2020/joao-victor-oliva-o-primeiro-brasileiro-na-vila-olimpica-em-toquio-preferia-chegar-com-um-monte-de-gente-25112009
22,DJ Ivis não é o único covarde,https://blogs.oglobo.globo.com/ruth-de-aquino/post/dj-ivis-nao-e-o-unico-covarde.html
23,Classe C vai perder R$ 10 bi por ano com Reforma Tributária,https://blogs.oglobo.globo.com/miriam-leitao/post/reforma-vai-tirar-r-10-bi-da-classe-c.html
24,Cuba fica atrás do Irã em democracia,https://blogs.oglobo.globo.com/guga-chacra/post/cuba-fica-atras-do-ira-em-democracia.html
25,Ofício da Precisa a Elcio Franco contradiz versão sobre pagamento por vacinas,https://blogs.oglobo.globo.com/lauro-jardim/post/oficio-da-precisa-elcio-franco-contradiz-versao-sobre-pagamento-por-vacinas.html
26,Outros destaques,https://oglobo.globo.com/ultimas-noticias
27, Vídeo: passageira é imobilizada com fita adesiva em poltrona de avião após morder comissário ,https://oglobo.globo.com/mundo/video-passageira-imobilizada-com-fita-adesiva-em-poltrona-de-aviao-apos-morder-comissario-1-25110948
28,"Censo será prioridade no Orçamento, mas somente de 2022",https://oglobo.globo.com/economia/censo-sera-prioridade-no-orcamento-de-2022-25112249
29,Mais de 300 mil poupadores prejudicados por planos econômicos ainda não aderiram a acordo para indenização,https://oglobo.globo.com/economia/mais-de-300-mil-poupadores-prejudicados-por-planos-economicos-ainda-nao-aderiram-acordo-para-indenizacao-1-25112273
30,"
Recuperado, paciente infectado com variante Delta em SP tinha recebido uma dose da AstraZeneca
",https://oglobo.globo.com/sociedade/saude/recuperado-paciente-infectado-com-variante-delta-em-sp-tinha-recebido-uma-dose-da-astrazeneca-25111593
31,"
Duas farmácias são fechadas no Méier e no Recreio por venda ilegal de medicamentos e tráfico de drogas
",https://oglobo.globo.com/rio/duas-farmacias-sao-fechadas-no-meier-no-recreio-por-venda-ilegal-de-medicamentos-trafico-de-drogas-25111505
32,"
Média móvel de mortes por Covid segue em queda, com 1.244 vítimas
",https://oglobo.globo.com/sociedade/saude/media-movel-de-mortes-por-covid-19-segue-em-queda-com-1244-vitimas-25111956
33,Preso um dos suspeitos de envolvimento na morte de estudante sequestrado na Zona Sul do Rio,https://oglobo.globo.com/rio/integrante-de-quadrilha-de-traficantes-de-classe-media-preso-enquanto-assistia-jogo-de-futevolei-em-copacabana-25111160
34,"Homem trans é agredido a golpes de facão pelo padrasto, em Sergipe",https://oglobo.globo.com/brasil/homem-trans-agredido-golpes-de-facao-pelo-padrasto-em-sergipe-25111682
35, Aluno de física de 18 anos viajará com Bezos em 1º voo de turismo espacial ,https://oglobo.globo.com/economia/aluno-de-fisica-de-18-anos-viajara-com-bezos-em-1-voo-de-turismo-espacial-25112040
36,Ancine veta apoio a filme sobre FH que já havia sido aprovado,https://oglobo.globo.com/cultura/ancine-veta-apoio-filme-sobre-fhc-que-ja-havia-sido-aprovado-25110725
37,Olavo de Carvalho é operado para extração de lesões na bexiga ,https://oglobo.globo.com/brasil/olavo-de-carvalho-operado-para-extracao-de-lesoes-na-bexigaem-sp-25111020
38," Bernardo M. Franco: Presidente da República é um servidor público, sim: está no Código Penal ",https://blogs.oglobo.globo.com/bernardo-mello-franco/post/o-presidente-que-nao-serve.html
39," Vera Magalhães: Pausa na CPI é estratégica e bem-vinda, estamos todos exaustos ",https://blogs.oglobo.globo.com/vera-magalhaes/post/pausa-na-cpi-e-bem-vinda.html
40," Principal cartão-postal da França, Torre Eiffel reabre ao público nesta sexta-feira ",https://oglobo.globo.com/mundo/epoca/principal-cartao-postal-da-franca-torre-eiffel-reabre-ao-publico-nesta-sexta-feira-25111167
41, Mais de 300 mil poupadores prejudicados por planos econômicos ainda não aderiram a acordo para indenização ,https://oglobo.globo.com/economia/mais-de-300-mil-poupadores-prejudicados-por-planos-economicos-ainda-nao-aderiram-acordo-para-indenizacao-1-25112273
42, Tire suas dúvidas sobre a bolsa de R$ 550 que governo quer criar para treinar jovens ,https://oglobo.globo.com/economia/tire-suas-duvidas-sobre-bolsa-de-550-que-governo-quer-criar-para-treinar-jovens-25112212
43,"
Governo do DF autoriza torcida, e Flamengo transfere partida da Libertadores para Brasília
",https://oglobo.globo.com/esportes/governo-do-df-autorizapublico-em-jogos-flamengotransfere-partida-da-libertadores-para-mane-garrincha-25111420
