,title,url
0,Bolsonaristas modulam discurso sobre PP: 'o partido fica em segundo plano' ,https://blogs.oglobo.globo.com/lauro-jardim/post/bolsonaristas-modulam-discurso-sobre-pp-o-partido-fica-em-segundo-plano.html
1,Lula e Bolsonaro concordaram em algo... e os dois estão certos,https://blogs.oglobo.globo.com/bernardo-mello-franco/post/lula-e-bolsonaro-concordaram-em-algo-e-os-dois-estao-certos.html
2,Amigo de Trump que tentou comprar a Oi é preso,https://blogs.oglobo.globo.com/capital/post/amigo-de-trump-que-tentou-comprar-oi-e-preso.html
3,Alcolumbre articula para emplacar Pacheco contra Mendonça no Supremo ,https://blogs.oglobo.globo.com/malu-gaspar/post/o-plano-de-davi-alcolumbre-para-tantar-barrar-andre-mendonca-no-supremo.html
4, Malu Gaspar: Bolsonaro entrega fílé do governo ao Centrão para não ter o mesmo final de Dilma ,https://blogs.oglobo.globo.com/malu-gaspar/post/com-ciro-nogueira-bolsonaro-entrega-orcamento-secreto-e-seu-futuro-politico-ao-centrao.html
5,"Bela Megale: Futuro ministro, Ciro Nogueira já garante que André Mendonça será aprovado para o STF",https://blogs.oglobo.globo.com/bela-megale/post/futuro-ministro-ciro-nogueira-ja-garante-que-andre-mendonca-sera-aprovado-para-stf.html
6,Perfil: Ciro Nogueira foi alvo de denúncias da Lava-Jato e já esteve ao lado de Lula e Dilma,https://oglobo.globo.com/brasil/convidado-para-casa-civil-ciro-nogueira-foi-alvo-de-denuncias-da-lava-jato-ja-esteve-ao-lado-de-lula-dilma-25120922
7,"Em 14 estados, bolsonaristas querem proibir uso de palavras de linguagem neutra, como amigues, nas escolas",https://oglobo.globo.com/sociedade/educacao/em-ao-menos-14-estados-bolsonaristas-querem-proibir-uso-de-linguagem-neutra-nas-escolas-1-25120887
8,Opinião do GLOBO: Fundo eleitoral deveria ser corrigido pela inflação,https://blogs.oglobo.globo.com/opiniao/post/fundo-eleitoral-deveria-ser-corrigido-pela-inflacao.html
9, Veterano? Influencer? Promessa? Campeão mundial? Especial interativo revela as histórias e chances dos 302 atletas brasileiros ,https://infograficos.oglobo.globo.com/esportes/delegacao-brasil.html
10,"Mais da metade da delegação brasileira nasceu no Sudeste, tem entre 30 e 29 anos e estreia em Jogos",https://oglobo.globo.com/esportes/olimpiada-time-brasil-tem-concentracao-de-atletas-do-sudeste-mais-homens-que-mulheres-maioria-estreante-25121043
11,Futebol masculino pega a Alemanha às 8h30: saiba tudo sobre a estreia da seleção,https://oglobo.globo.com/esportes/toquio-2020/tudo-que-voce-precisa-saber-sobre-estreia-do-brasil-o-torneio-de-futebol-masculino-na-olimpiada-25120423
12,"
Análise: Flamengo oscila em goleada sobre o Defensa y Justicia, mas aprende com o próprio erro
",https://oglobo.globo.com/esportes/analise-flamengo-oscila-em-goleada-sobre-defensa-justicia-mas-aprende-com-proprio-erro-1-25121015
13,"Com ‘Muito prazer’, Pocah anuncia álbum: ‘A minha boca é uma bazuca. Tenho muito para falar’",https://oglobo.globo.com/cultura/musica/com-muito-prazer-pocah-anuncia-album-minha-boca-uma-bazuca-tenho-muito-para-falar-25120701
14,Festas clandestinas em casas de swing e saunas do Rio são monitoradas pela prefeitura nas redes sociais,https://oglobo.globo.com/rio/festas-clandestinas-em-casas-de-swing-saunas-do-rio-sao-monitoradas-pela-prefeitura-nas-redes-sociais-25120466
15,"Roberto Lent: O cérebro tem circuitos secretos, para o bem e para o mal",https://blogs.oglobo.globo.com/a-hora-da-ciencia/post/o-cerebro-tem-circuitos-secretos-para-o-bem-e-para-o-mal.html
16,ESG: Índice de Sustentabilidade Empresarial exige mais compromissos socioambientais das companhias na Bolsa,https://oglobo.globo.com/economia/investimentos/esg-indice-de-sustentabilidade-empresarial-exige-mais-compromissos-socioambientais-das-companhias-na-bolsa-25120873
17,OLIMPÍADA DE TÓQUIO,https://oglobo.globo.com/esportes/toquio-2020/
18,Cerimônia de abertura é cercada de problemas e mistério,https://oglobo.globo.com/esportes/toquio-2020/olimpiadas-cerimonia-de-abertura-cercada-de-problemas-misterio-25120916
19,"
Estreando em Olimpíadas, skate tem a atleta mais nova do Brasil e também dos Jogos
",https://oglobo.globo.com/esportes/interolimpico/estreando-em-olimpiadas-skate-tem-atleta-mais-nova-do-brasil-tambem-dos-jogos-25120356
20,Alexandre Alliatti: Olimpíada reforçará que a beleza é o oposto da morte,https://oglobo.globo.com/esportes/alexandre-alliatti-olimpiada-reforcara-que-beleza-o-oposto-da-morte-25120925
21,"Brasil conhece seus adversários no judô, e Rafael Silva escapa de Teddy Riner até a semifinal ",https://oglobo.globo.com/esportes/olimpiadas-brasil-conhece-seus-adversarios-no-judo-rafael-silva-escapa-de-teddy-riner-ate-semifinal-25121055
22,"Zenvia, empresa brasileira de tecnologia, levanta R$ 1 bilhão em IPO na Nasdaq",https://blogs.oglobo.globo.com/capital/post/zenvia-empresa-brasileira-de-tecnologia-levanta-r-1-bilhao-em-ipo-na-nasdaq.html
23,"Mal do sistema é a reeleição, não o presidencialismo",https://oglobo.globo.com/opiniao/semipresidencialismo-um-velho-golpe-25119105
24,As chances de Aras ter seu nome aprovado no Senado,https://blogs.oglobo.globo.com/lauro-jardim/post/chances-de-aras-no-senado.html
25,A louca do esquilo: os primeiros tempos morando em Nova York,https://oglobo.globo.com/cultura/a-louca-do-esquilo-1-25118737
26,Outros destaques,https://oglobo.globo.com/ultimas-noticias
27," Ministério da Saúde prevê entrega de 63,3 milhões de doses de vacina para agosto ",https://oglobo.globo.com/sociedade/saude/ministerio-da-saude-preve-entrega-de-633-milhoes-de-doses-de-vacina-para-agosto-25120798
28,"Confira o calendário de vacinação nesta quinta-feira em São Paulo, Rio, Niterói e mais 6 cidades",https://oglobo.globo.com/sociedade/saude/confira-calendario-de-vacinacao-nesta-quinta-feira-em-sao-paulo-rio-niteroi-mais-seis-cidades-3-24910341
29,"Morre o jornalista especializado em tecnologia André Machado, aos 58 anos, de Covid-19",https://oglobo.globo.com/economia/morre-jornalista-especializado-em-tecnologia-andre-machado-aos-58-anos-de-covid-19-25120932
30,"
Ao Ponto: O avanço do Centrão no governo Bolsonaro
",https://oglobo.globo.com/podcast/o-avanco-do-centrao-no-governo-bolsonaro-25120405
31,"
Analítico: Por que Mourão vai representar governo Bolsonaro na posse do presidente do Peru
",https://oglobo.globo.com/analitico/por-que-mourao-vai-representar-governo-bolsonaro-na-posse-do-presidente-do-peru-25120412
32,"
Polícia Militar afasta PM que agrediu advogado em Goiânia; vídeo repercute
",https://oglobo.globo.com/brasil/policial-militar-envolvido-em-agressao-advogado-em-goiania-afastado-video-repercute-1-25120731
33,Polícia Civil afasta agente da Core que matou cadela na Praça da Bandeira,https://oglobo.globo.com/rio/policia-civil-decide-afastar-temporariamente-agente-da-core-que-matou-cadela-na-praca-da-bandeira-1-25120025
34,Operação da Polícia Civil contra milícia resulta na prisão de 18 pessoas na capital e na Baixada,https://oglobo.globo.com/rio/operacao-da-policia-civil-contra-milicia-resulta-na-prisao-de-18-pessoas-na-capital-na-baixada-fluminense-1-25120929
35, China testa aeronave hipersônica capaz de viajar o mundo em uma hora ,https://oglobo.globo.com/economia/tecnologia/china-testa-aeronave-hipersonica-capaz-de-viajar-mundo-em-uma-hora-25119572
36,Barcelona elimina Vélez e pode pintar no caminho do Fluminense na Libertadores,https://oglobo.globo.com/esportes/barcelona-elimina-velez-sarsfield-pode-pintar-no-caminho-do-fluminense-na-libertadores-25120564
37,Palmeiras passa sem sustos pela Universidad Católica e confirma clássico com São Paulo,https://oglobo.globo.com/esportes/palmeiras-passa-sem-sustos-pela-universidad-catolica-confirma-classico-contra-sao-paulo-nas-quartas-da-libertadores-25120854
38," Roberto Lent: O cérebro tem circuitos secretos, para o bem e para o mal ",https://blogs.oglobo.globo.com/a-hora-da-ciencia/post/o-cerebro-tem-circuitos-secretos-para-o-bem-e-para-o-mal.html
39," No elenco de 'Doutor Gama', Mariana Nunes fala sobre racismo: 'Mais do que sobreviver, queremos viver' ",https://oglobo.globo.com/ela/gente/no-elenco-de-doutor-gama-mariana-nunes-fala-sobre-racismo-mais-do-que-sobreviver-queremos-viver-25120527
40, Olímpiadas: cerimônia de abertura é cercada de problemas e mistério ,https://oglobo.globo.com/esportes/toquio-2020/olimpiadas-cerimonia-de-abertura-cercada-de-problemas-misterio-25120916
41, Veterano? Influencer? Promessa? Campeão mundial? Especial interativo revela as histórias e chances dos 302 atletas brasileiros ,https://infograficos.oglobo.globo.com/esportes/delegacao-brasil.html
42, Opinião do GLOBO: Fundo eleitoral deveria ser corrigido pela inflação ,https://blogs.oglobo.globo.com/opiniao/post/fundo-eleitoral-deveria-ser-corrigido-pela-inflacao.html
43,"
""Por trás da diversão"": série conta a história de atrações da Disney na Flórida e na Califórnia
",https://oglobo.globo.com/boa-viagem/por-tras-da-diversao-serie-conta-historia-de-atracoes-da-disney-na-florida-na-california-25120478
